No.     Time           Source                Destination           Protocol Length Info
      2 0.098888       10.248.150.150        172.217.175.3         TCP      55     58882 → 443 [ACK] Seq=1 Ack=1 Win=508 Len=1 [TCP segment of a reassembled PDU]

Frame 2: 55 bytes on wire (440 bits), 55 bytes captured (440 bits) on interface \Device\NPF_{17019924-785A-4048-BC19-D72C2B93C6B0}, id 0
Ethernet II, Src: Microsof_17:9c:00 (bc:83:85:17:9c:00), Dst: Cisco_9f:fa:f9 (00:00:0c:9f:fa:f9)
Internet Protocol Version 4, Src: 10.248.150.150, Dst: 172.217.175.3
Transmission Control Protocol, Src Port: 58882, Dst Port: 443, Seq: 1, Ack: 1, Len: 1
    Source Port: 58882
    Destination Port: 443
    [Stream index: 0]
    [TCP Segment Len: 1]
    Sequence number: 1    (relative sequence number)
    Sequence number (raw): 1505460626
    [Next sequence number: 2    (relative sequence number)]
    Acknowledgment number: 1    (relative ack number)
    Acknowledgment number (raw): 1980736662
    0101 .... = Header Length: 20 bytes (5)
    Flags: 0x010 (ACK)
    Window size value: 508
    [Calculated window size: 508]
    [Window size scaling factor: -1 (unknown)]
    Checksum: 0xd2ba [unverified]
    [Checksum Status: Unverified]
    Urgent pointer: 0
    [SEQ/ACK analysis]
    [Timestamps]
    TCP payload (1 byte)
    TCP segment data (1 byte)

No.     Time           Source                Destination           Protocol Length Info
      3 0.218788       172.217.175.3         10.248.150.150        TCP      66     443 → 58882 [ACK] Seq=1 Ack=2 Win=246 Len=0 SLE=1 SRE=2

Frame 3: 66 bytes on wire (528 bits), 66 bytes captured (528 bits) on interface \Device\NPF_{17019924-785A-4048-BC19-D72C2B93C6B0}, id 0
Ethernet II, Src: Cisco_53:71:40 (1c:e6:c7:53:71:40), Dst: Microsof_17:9c:00 (bc:83:85:17:9c:00)
Internet Protocol Version 4, Src: 172.217.175.3, Dst: 10.248.150.150
Transmission Control Protocol, Src Port: 443, Dst Port: 58882, Seq: 1, Ack: 2, Len: 0
    Source Port: 443
    Destination Port: 58882
    [Stream index: 0]
    [TCP Segment Len: 0]
    Sequence number: 1    (relative sequence number)
    Sequence number (raw): 1980736662
    [Next sequence number: 1    (relative sequence number)]
    Acknowledgment number: 2    (relative ack number)
    Acknowledgment number (raw): 1505460627
    1000 .... = Header Length: 32 bytes (8)
    Flags: 0x010 (ACK)
    Window size value: 246
    [Calculated window size: 246]
    [Window size scaling factor: -1 (unknown)]
    Checksum: 0xe70c [unverified]
    [Checksum Status: Unverified]
    Urgent pointer: 0
    Options: (12 bytes), No-Operation (NOP), No-Operation (NOP), SACK
    [SEQ/ACK analysis]
    [Timestamps]

No.     Time           Source                Destination           Protocol Length Info
      7 0.846659       10.248.150.150        40.118.201.45         TCP      66     59041 → 443 [SYN] Seq=0 Win=64240 Len=0 MSS=1460 WS=256 SACK_PERM=1

Frame 7: 66 bytes on wire (528 bits), 66 bytes captured (528 bits) on interface \Device\NPF_{17019924-785A-4048-BC19-D72C2B93C6B0}, id 0
Ethernet II, Src: Microsof_17:9c:00 (bc:83:85:17:9c:00), Dst: Cisco_9f:fa:f9 (00:00:0c:9f:fa:f9)
Internet Protocol Version 4, Src: 10.248.150.150, Dst: 40.118.201.45
Transmission Control Protocol, Src Port: 59041, Dst Port: 443, Seq: 0, Len: 0
    Source Port: 59041
    Destination Port: 443
    [Stream index: 1]
    [TCP Segment Len: 0]
    Sequence number: 0    (relative sequence number)
    Sequence number (raw): 2253877430
    [Next sequence number: 1    (relative sequence number)]
    Acknowledgment number: 0
    Acknowledgment number (raw): 0
    1000 .... = Header Length: 32 bytes (8)
    Flags: 0x002 (SYN)
    Window size value: 64240
    [Calculated window size: 64240]
    Checksum: 0x0183 [unverified]
    [Checksum Status: Unverified]
    Urgent pointer: 0
    Options: (12 bytes), Maximum segment size, No-Operation (NOP), Window scale, No-Operation (NOP), No-Operation (NOP), SACK permitted
    [Timestamps]

No.     Time           Source                Destination           Protocol Length Info
      9 1.046906       40.118.201.45         10.248.150.150        TCP      66     443 → 59041 [SYN, ACK] Seq=0 Ack=1 Win=29200 Len=0 MSS=1440 SACK_PERM=1 WS=128

Frame 9: 66 bytes on wire (528 bits), 66 bytes captured (528 bits) on interface \Device\NPF_{17019924-785A-4048-BC19-D72C2B93C6B0}, id 0
Ethernet II, Src: Cisco_53:71:40 (1c:e6:c7:53:71:40), Dst: Microsof_17:9c:00 (bc:83:85:17:9c:00)
Internet Protocol Version 4, Src: 40.118.201.45, Dst: 10.248.150.150
Transmission Control Protocol, Src Port: 443, Dst Port: 59041, Seq: 0, Ack: 1, Len: 0
    Source Port: 443
    Destination Port: 59041
    [Stream index: 1]
    [TCP Segment Len: 0]
    Sequence number: 0    (relative sequence number)
    Sequence number (raw): 3228437598
    [Next sequence number: 1    (relative sequence number)]
    Acknowledgment number: 1    (relative ack number)
    Acknowledgment number (raw): 2253877431
    1000 .... = Header Length: 32 bytes (8)
    Flags: 0x012 (SYN, ACK)
    Window size value: 29200
    [Calculated window size: 29200]
    Checksum: 0xbd9a [unverified]
    [Checksum Status: Unverified]
    Urgent pointer: 0
    Options: (12 bytes), Maximum segment size, No-Operation (NOP), No-Operation (NOP), SACK permitted, No-Operation (NOP), Window scale
    [SEQ/ACK analysis]
    [Timestamps]

No.     Time           Source                Destination           Protocol Length Info
     10 1.047040       10.248.150.150        40.118.201.45         TCP      54     59041 → 443 [ACK] Seq=1 Ack=1 Win=132352 Len=0

Frame 10: 54 bytes on wire (432 bits), 54 bytes captured (432 bits) on interface \Device\NPF_{17019924-785A-4048-BC19-D72C2B93C6B0}, id 0
Ethernet II, Src: Microsof_17:9c:00 (bc:83:85:17:9c:00), Dst: Cisco_9f:fa:f9 (00:00:0c:9f:fa:f9)
Internet Protocol Version 4, Src: 10.248.150.150, Dst: 40.118.201.45
Transmission Control Protocol, Src Port: 59041, Dst Port: 443, Seq: 1, Ack: 1, Len: 0
    Source Port: 59041
    Destination Port: 443
    [Stream index: 1]
    [TCP Segment Len: 0]
    Sequence number: 1    (relative sequence number)
    Sequence number (raw): 2253877431
    [Next sequence number: 1    (relative sequence number)]
    Acknowledgment number: 1    (relative ack number)
    Acknowledgment number (raw): 3228437599
    0101 .... = Header Length: 20 bytes (5)
    Flags: 0x010 (ACK)
    Window size value: 517
    [Calculated window size: 132352]
    [Window size scaling factor: 256]
    Checksum: 0x6e64 [unverified]
    [Checksum Status: Unverified]
    Urgent pointer: 0
    [SEQ/ACK analysis]
    [Timestamps]

No.     Time           Source                Destination           Protocol Length Info
     11 1.051346       10.248.150.150        40.118.201.45         TLSv1.2  249    Client Hello

Frame 11: 249 bytes on wire (1992 bits), 249 bytes captured (1992 bits) on interface \Device\NPF_{17019924-785A-4048-BC19-D72C2B93C6B0}, id 0
Ethernet II, Src: Microsof_17:9c:00 (bc:83:85:17:9c:00), Dst: Cisco_9f:fa:f9 (00:00:0c:9f:fa:f9)
Internet Protocol Version 4, Src: 10.248.150.150, Dst: 40.118.201.45
Transmission Control Protocol, Src Port: 59041, Dst Port: 443, Seq: 1, Ack: 1, Len: 195
    Source Port: 59041
    Destination Port: 443
    [Stream index: 1]
    [TCP Segment Len: 195]
    Sequence number: 1    (relative sequence number)
    Sequence number (raw): 2253877431
    [Next sequence number: 196    (relative sequence number)]
    Acknowledgment number: 1    (relative ack number)
    Acknowledgment number (raw): 3228437599
    0101 .... = Header Length: 20 bytes (5)
    Flags: 0x018 (PSH, ACK)
    Window size value: 517
    [Calculated window size: 132352]
    [Window size scaling factor: 256]
    Checksum: 0x5371 [unverified]
    [Checksum Status: Unverified]
    Urgent pointer: 0
    [SEQ/ACK analysis]
    [Timestamps]
    TCP payload (195 bytes)
Transport Layer Security

No.     Time           Source                Destination           Protocol Length Info
     12 1.249989       40.118.201.45         10.248.150.150        TCP      54     443 → 59041 [ACK] Seq=1 Ack=196 Win=30336 Len=0

Frame 12: 54 bytes on wire (432 bits), 54 bytes captured (432 bits) on interface \Device\NPF_{17019924-785A-4048-BC19-D72C2B93C6B0}, id 0
Ethernet II, Src: Cisco_53:71:40 (1c:e6:c7:53:71:40), Dst: Microsof_17:9c:00 (bc:83:85:17:9c:00)
Internet Protocol Version 4, Src: 40.118.201.45, Dst: 10.248.150.150
Transmission Control Protocol, Src Port: 443, Dst Port: 59041, Seq: 1, Ack: 196, Len: 0
    Source Port: 443
    Destination Port: 59041
    [Stream index: 1]
    [TCP Segment Len: 0]
    Sequence number: 1    (relative sequence number)
    Sequence number (raw): 3228437599
    [Next sequence number: 1    (relative sequence number)]
    Acknowledgment number: 196    (relative ack number)
    Acknowledgment number (raw): 2253877626
    0101 .... = Header Length: 20 bytes (5)
    Flags: 0x010 (ACK)
    Window size value: 237
    [Calculated window size: 30336]
    [Window size scaling factor: 128]
    Checksum: 0x6eb9 [unverified]
    [Checksum Status: Unverified]
    Urgent pointer: 0
    [SEQ/ACK analysis]
    [Timestamps]

No.     Time           Source                Destination           Protocol Length Info
     13 1.250128       40.118.201.45         10.248.150.150        TLSv1.2  1514   Server Hello

Frame 13: 1514 bytes on wire (12112 bits), 1514 bytes captured (12112 bits) on interface \Device\NPF_{17019924-785A-4048-BC19-D72C2B93C6B0}, id 0
Ethernet II, Src: Cisco_53:71:40 (1c:e6:c7:53:71:40), Dst: Microsof_17:9c:00 (bc:83:85:17:9c:00)
Internet Protocol Version 4, Src: 40.118.201.45, Dst: 10.248.150.150
Transmission Control Protocol, Src Port: 443, Dst Port: 59041, Seq: 1, Ack: 196, Len: 1460
    Source Port: 443
    Destination Port: 59041
    [Stream index: 1]
    [TCP Segment Len: 1460]
    Sequence number: 1    (relative sequence number)
    Sequence number (raw): 3228437599
    [Next sequence number: 1461    (relative sequence number)]
    Acknowledgment number: 196    (relative ack number)
    Acknowledgment number (raw): 2253877626
    0101 .... = Header Length: 20 bytes (5)
    Flags: 0x010 (ACK)
    Window size value: 237
    [Calculated window size: 30336]
    [Window size scaling factor: 128]
    Checksum: 0x1669 [unverified]
    [Checksum Status: Unverified]
    Urgent pointer: 0
    [SEQ/ACK analysis]
    [Timestamps]
    TCP payload (1460 bytes)
    TCP segment data (1379 bytes)
Transport Layer Security

No.     Time           Source                Destination           Protocol Length Info
     14 1.250540       40.118.201.45         10.248.150.150        TCP      1514   443 → 59041 [ACK] Seq=1461 Ack=196 Win=30336 Len=1460 [TCP segment of a reassembled PDU]

Frame 14: 1514 bytes on wire (12112 bits), 1514 bytes captured (12112 bits) on interface \Device\NPF_{17019924-785A-4048-BC19-D72C2B93C6B0}, id 0
Ethernet II, Src: Cisco_53:71:40 (1c:e6:c7:53:71:40), Dst: Microsof_17:9c:00 (bc:83:85:17:9c:00)
Internet Protocol Version 4, Src: 40.118.201.45, Dst: 10.248.150.150
Transmission Control Protocol, Src Port: 443, Dst Port: 59041, Seq: 1461, Ack: 196, Len: 1460
    Source Port: 443
    Destination Port: 59041
    [Stream index: 1]
    [TCP Segment Len: 1460]
    Sequence number: 1461    (relative sequence number)
    Sequence number (raw): 3228439059
    [Next sequence number: 2921    (relative sequence number)]
    Acknowledgment number: 196    (relative ack number)
    Acknowledgment number (raw): 2253877626
    0101 .... = Header Length: 20 bytes (5)
    Flags: 0x010 (ACK)
    Window size value: 237
    [Calculated window size: 30336]
    [Window size scaling factor: 128]
    Checksum: 0x8ef5 [unverified]
    [Checksum Status: Unverified]
    Urgent pointer: 0
    [SEQ/ACK analysis]
    [Timestamps]
    TCP payload (1460 bytes)
    [Reassembled PDU in frame: 16]
    TCP segment data (1460 bytes)

No.     Time           Source                Destination           Protocol Length Info
     15 1.250634       10.248.150.150        40.118.201.45         TCP      54     59041 → 443 [ACK] Seq=196 Ack=2921 Win=132352 Len=0

Frame 15: 54 bytes on wire (432 bits), 54 bytes captured (432 bits) on interface \Device\NPF_{17019924-785A-4048-BC19-D72C2B93C6B0}, id 0
Ethernet II, Src: Microsof_17:9c:00 (bc:83:85:17:9c:00), Dst: Cisco_9f:fa:f9 (00:00:0c:9f:fa:f9)
Internet Protocol Version 4, Src: 10.248.150.150, Dst: 40.118.201.45
Transmission Control Protocol, Src Port: 59041, Dst Port: 443, Seq: 196, Ack: 2921, Len: 0
    Source Port: 59041
    Destination Port: 443
    [Stream index: 1]
    [TCP Segment Len: 0]
    Sequence number: 196    (relative sequence number)
    Sequence number (raw): 2253877626
    [Next sequence number: 196    (relative sequence number)]
    Acknowledgment number: 2921    (relative ack number)
    Acknowledgment number (raw): 3228440519
    0101 .... = Header Length: 20 bytes (5)
    Flags: 0x010 (ACK)
    Window size value: 517
    [Calculated window size: 132352]
    [Window size scaling factor: 256]
    Checksum: 0x6239 [unverified]
    [Checksum Status: Unverified]
    Urgent pointer: 0
    [SEQ/ACK analysis]
    [Timestamps]

No.     Time           Source                Destination           Protocol Length Info
     16 1.250700       40.118.201.45         10.248.150.150        TLSv1.2  427    Certificate, Server Key Exchange, Server Hello Done

Frame 16: 427 bytes on wire (3416 bits), 427 bytes captured (3416 bits) on interface \Device\NPF_{17019924-785A-4048-BC19-D72C2B93C6B0}, id 0
Ethernet II, Src: Cisco_53:71:40 (1c:e6:c7:53:71:40), Dst: Microsof_17:9c:00 (bc:83:85:17:9c:00)
Internet Protocol Version 4, Src: 40.118.201.45, Dst: 10.248.150.150
Transmission Control Protocol, Src Port: 443, Dst Port: 59041, Seq: 2921, Ack: 196, Len: 373
    Source Port: 443
    Destination Port: 59041
    [Stream index: 1]
    [TCP Segment Len: 373]
    Sequence number: 2921    (relative sequence number)
    Sequence number (raw): 3228440519
    [Next sequence number: 3294    (relative sequence number)]
    Acknowledgment number: 196    (relative ack number)
    Acknowledgment number (raw): 2253877626
    0101 .... = Header Length: 20 bytes (5)
    Flags: 0x018 (PSH, ACK)
    Window size value: 237
    [Calculated window size: 30336]
    [Window size scaling factor: 128]
    Checksum: 0xf19d [unverified]
    [Checksum Status: Unverified]
    Urgent pointer: 0
    [SEQ/ACK analysis]
    [Timestamps]
    TCP payload (373 bytes)
    TCP segment data (26 bytes)
[3 Reassembled TCP Segments (2865 bytes): #13(1379), #14(1460), #16(26)]
Transport Layer Security
Transport Layer Security

No.     Time           Source                Destination           Protocol Length Info
     17 1.252381       10.248.150.150        40.118.201.45         TLSv1.2  180    Client Key Exchange, Change Cipher Spec, Encrypted Handshake Message

Frame 17: 180 bytes on wire (1440 bits), 180 bytes captured (1440 bits) on interface \Device\NPF_{17019924-785A-4048-BC19-D72C2B93C6B0}, id 0
Ethernet II, Src: Microsof_17:9c:00 (bc:83:85:17:9c:00), Dst: Cisco_9f:fa:f9 (00:00:0c:9f:fa:f9)
Internet Protocol Version 4, Src: 10.248.150.150, Dst: 40.118.201.45
Transmission Control Protocol, Src Port: 59041, Dst Port: 443, Seq: 196, Ack: 3294, Len: 126
    Source Port: 59041
    Destination Port: 443
    [Stream index: 1]
    [TCP Segment Len: 126]
    Sequence number: 196    (relative sequence number)
    Sequence number (raw): 2253877626
    [Next sequence number: 322    (relative sequence number)]
    Acknowledgment number: 3294    (relative ack number)
    Acknowledgment number (raw): 3228440892
    0101 .... = Header Length: 20 bytes (5)
    Flags: 0x018 (PSH, ACK)
    Window size value: 516
    [Calculated window size: 132096]
    [Window size scaling factor: 256]
    Checksum: 0x9a6b [unverified]
    [Checksum Status: Unverified]
    Urgent pointer: 0
    [SEQ/ACK analysis]
    [Timestamps]
    TCP payload (126 bytes)
Transport Layer Security

No.     Time           Source                Destination           Protocol Length Info
     19 1.458849       40.118.201.45         10.248.150.150        TLSv1.2  312    New Session Ticket, Change Cipher Spec, Encrypted Handshake Message

Frame 19: 312 bytes on wire (2496 bits), 312 bytes captured (2496 bits) on interface \Device\NPF_{17019924-785A-4048-BC19-D72C2B93C6B0}, id 0
Ethernet II, Src: Cisco_53:71:40 (1c:e6:c7:53:71:40), Dst: Microsof_17:9c:00 (bc:83:85:17:9c:00)
Internet Protocol Version 4, Src: 40.118.201.45, Dst: 10.248.150.150
Transmission Control Protocol, Src Port: 443, Dst Port: 59041, Seq: 3294, Ack: 322, Len: 258
    Source Port: 443
    Destination Port: 59041
    [Stream index: 1]
    [TCP Segment Len: 258]
    Sequence number: 3294    (relative sequence number)
    Sequence number (raw): 3228440892
    [Next sequence number: 3552    (relative sequence number)]
    Acknowledgment number: 322    (relative ack number)
    Acknowledgment number (raw): 2253877752
    0101 .... = Header Length: 20 bytes (5)
    Flags: 0x018 (PSH, ACK)
    Window size value: 237
    [Calculated window size: 30336]
    [Window size scaling factor: 128]
    Checksum: 0x5463 [unverified]
    [Checksum Status: Unverified]
    Urgent pointer: 0
    [SEQ/ACK analysis]
    [Timestamps]
    TCP payload (258 bytes)
Transport Layer Security

No.     Time           Source                Destination           Protocol Length Info
     20 1.491420       10.248.150.150        40.118.201.45         TLSv1.2  780    Application Data

Frame 20: 780 bytes on wire (6240 bits), 780 bytes captured (6240 bits) on interface \Device\NPF_{17019924-785A-4048-BC19-D72C2B93C6B0}, id 0
Ethernet II, Src: Microsof_17:9c:00 (bc:83:85:17:9c:00), Dst: Cisco_9f:fa:f9 (00:00:0c:9f:fa:f9)
Internet Protocol Version 4, Src: 10.248.150.150, Dst: 40.118.201.45
Transmission Control Protocol, Src Port: 59041, Dst Port: 443, Seq: 322, Ack: 3552, Len: 726
    Source Port: 59041
    Destination Port: 443
    [Stream index: 1]
    [TCP Segment Len: 726]
    Sequence number: 322    (relative sequence number)
    Sequence number (raw): 2253877752
    [Next sequence number: 1048    (relative sequence number)]
    Acknowledgment number: 3552    (relative ack number)
    Acknowledgment number (raw): 3228441150
    0101 .... = Header Length: 20 bytes (5)
    Flags: 0x018 (PSH, ACK)
    Window size value: 515
    [Calculated window size: 131840]
    [Window size scaling factor: 256]
    Checksum: 0xa7c8 [unverified]
    [Checksum Status: Unverified]
    Urgent pointer: 0
    [SEQ/ACK analysis]
    [Timestamps]
    TCP payload (726 bytes)
Transport Layer Security

No.     Time           Source                Destination           Protocol Length Info
     21 1.559747       10.248.150.150        172.217.25.134        TCP      55     58884 → 443 [ACK] Seq=1 Ack=1 Win=512 Len=1 [TCP segment of a reassembled PDU]

Frame 21: 55 bytes on wire (440 bits), 55 bytes captured (440 bits) on interface \Device\NPF_{17019924-785A-4048-BC19-D72C2B93C6B0}, id 0
Ethernet II, Src: Microsof_17:9c:00 (bc:83:85:17:9c:00), Dst: Cisco_9f:fa:f9 (00:00:0c:9f:fa:f9)
Internet Protocol Version 4, Src: 10.248.150.150, Dst: 172.217.25.134
Transmission Control Protocol, Src Port: 58884, Dst Port: 443, Seq: 1, Ack: 1, Len: 1
    Source Port: 58884
    Destination Port: 443
    [Stream index: 2]
    [TCP Segment Len: 1]
    Sequence number: 1    (relative sequence number)
    Sequence number (raw): 1703178253
    [Next sequence number: 2    (relative sequence number)]
    Acknowledgment number: 1    (relative ack number)
    Acknowledgment number (raw): 3818128808
    0101 .... = Header Length: 20 bytes (5)
    Flags: 0x010 (ACK)
    Window size value: 512
    [Calculated window size: 512]
    [Window size scaling factor: -1 (unknown)]
    Checksum: 0x9f57 [unverified]
    [Checksum Status: Unverified]
    Urgent pointer: 0
    [SEQ/ACK analysis]
    [Timestamps]
    TCP payload (1 byte)
    TCP segment data (1 byte)

No.     Time           Source                Destination           Protocol Length Info
     22 1.569028       172.217.25.134        10.248.150.150        TCP      66     443 → 58884 [ACK] Seq=1 Ack=2 Win=248 Len=0 SLE=1 SRE=2

Frame 22: 66 bytes on wire (528 bits), 66 bytes captured (528 bits) on interface \Device\NPF_{17019924-785A-4048-BC19-D72C2B93C6B0}, id 0
Ethernet II, Src: Cisco_53:71:40 (1c:e6:c7:53:71:40), Dst: Microsof_17:9c:00 (bc:83:85:17:9c:00)
Internet Protocol Version 4, Src: 172.217.25.134, Dst: 10.248.150.150
Transmission Control Protocol, Src Port: 443, Dst Port: 58884, Seq: 1, Ack: 2, Len: 0
    Source Port: 443
    Destination Port: 58884
    [Stream index: 2]
    [TCP Segment Len: 0]
    Sequence number: 1    (relative sequence number)
    Sequence number (raw): 3818128808
    [Next sequence number: 1    (relative sequence number)]
    Acknowledgment number: 2    (relative ack number)
    Acknowledgment number (raw): 1703178254
    1000 .... = Header Length: 32 bytes (8)
    Flags: 0x010 (ACK)
    Window size value: 248
    [Calculated window size: 248]
    [Window size scaling factor: -1 (unknown)]
    Checksum: 0xbf23 [unverified]
    [Checksum Status: Unverified]
    Urgent pointer: 0
    Options: (12 bytes), No-Operation (NOP), No-Operation (NOP), SACK
    [SEQ/ACK analysis]
    [Timestamps]

No.     Time           Source                Destination           Protocol Length Info
     23 1.653581       10.248.150.150        172.217.167.98        TCP      55     58888 → 443 [ACK] Seq=1 Ack=1 Win=506 Len=1 [TCP segment of a reassembled PDU]

Frame 23: 55 bytes on wire (440 bits), 55 bytes captured (440 bits) on interface \Device\NPF_{17019924-785A-4048-BC19-D72C2B93C6B0}, id 0
Ethernet II, Src: Microsof_17:9c:00 (bc:83:85:17:9c:00), Dst: Cisco_9f:fa:f9 (00:00:0c:9f:fa:f9)
Internet Protocol Version 4, Src: 10.248.150.150, Dst: 172.217.167.98
Transmission Control Protocol, Src Port: 58888, Dst Port: 443, Seq: 1, Ack: 1, Len: 1
    Source Port: 58888
    Destination Port: 443
    [Stream index: 3]
    [TCP Segment Len: 1]
    Sequence number: 1    (relative sequence number)
    Sequence number (raw): 3351653974
    [Next sequence number: 2    (relative sequence number)]
    Acknowledgment number: 1    (relative ack number)
    Acknowledgment number (raw): 3809125838
    0101 .... = Header Length: 20 bytes (5)
    Flags: 0x010 (ACK)
    Window size value: 506
    [Calculated window size: 506]
    [Window size scaling factor: -1 (unknown)]
    Checksum: 0x5155 [unverified]
    [Checksum Status: Unverified]
    Urgent pointer: 0
    [SEQ/ACK analysis]
    [Timestamps]
    TCP payload (1 byte)
    TCP segment data (1 byte)

No.     Time           Source                Destination           Protocol Length Info
     24 1.675615       172.217.167.98        10.248.150.150        TCP      66     443 → 58888 [ACK] Seq=1 Ack=2 Win=246 Len=0 SLE=1 SRE=2

Frame 24: 66 bytes on wire (528 bits), 66 bytes captured (528 bits) on interface \Device\NPF_{17019924-785A-4048-BC19-D72C2B93C6B0}, id 0
Ethernet II, Src: Cisco_53:71:40 (1c:e6:c7:53:71:40), Dst: Microsof_17:9c:00 (bc:83:85:17:9c:00)
Internet Protocol Version 4, Src: 172.217.167.98, Dst: 10.248.150.150
Transmission Control Protocol, Src Port: 443, Dst Port: 58888, Seq: 1, Ack: 2, Len: 0
    Source Port: 443
    Destination Port: 58888
    [Stream index: 3]
    [TCP Segment Len: 0]
    Sequence number: 1    (relative sequence number)
    Sequence number (raw): 3809125838
    [Next sequence number: 1    (relative sequence number)]
    Acknowledgment number: 2    (relative ack number)
    Acknowledgment number (raw): 3351653975
    1000 .... = Header Length: 32 bytes (8)
    Flags: 0x010 (ACK)
    Window size value: 246
    [Calculated window size: 246]
    [Window size scaling factor: -1 (unknown)]
    Checksum: 0x3007 [unverified]
    [Checksum Status: Unverified]
    Urgent pointer: 0
    Options: (12 bytes), No-Operation (NOP), No-Operation (NOP), SACK
    [SEQ/ACK analysis]
    [Timestamps]

No.     Time           Source                Destination           Protocol Length Info
     25 1.772098       40.118.201.45         10.248.150.150        TLSv1.2  299    Application Data

Frame 25: 299 bytes on wire (2392 bits), 299 bytes captured (2392 bits) on interface \Device\NPF_{17019924-785A-4048-BC19-D72C2B93C6B0}, id 0
Ethernet II, Src: Cisco_53:71:40 (1c:e6:c7:53:71:40), Dst: Microsof_17:9c:00 (bc:83:85:17:9c:00)
Internet Protocol Version 4, Src: 40.118.201.45, Dst: 10.248.150.150
Transmission Control Protocol, Src Port: 443, Dst Port: 59041, Seq: 3552, Ack: 1048, Len: 245
    Source Port: 443
    Destination Port: 59041
    [Stream index: 1]
    [TCP Segment Len: 245]
    Sequence number: 3552    (relative sequence number)
    Sequence number (raw): 3228441150
    [Next sequence number: 3797    (relative sequence number)]
    Acknowledgment number: 1048    (relative ack number)
    Acknowledgment number (raw): 2253878478
    0101 .... = Header Length: 20 bytes (5)
    Flags: 0x018 (PSH, ACK)
    Window size value: 248
    [Calculated window size: 31744]
    [Window size scaling factor: 128]
    Checksum: 0x0287 [unverified]
    [Checksum Status: Unverified]
    Urgent pointer: 0
    [SEQ/ACK analysis]
    [Timestamps]
    TCP payload (245 bytes)
Transport Layer Security

No.     Time           Source                Destination           Protocol Length Info
     26 1.812603       10.248.150.150        40.118.201.45         TCP      54     59041 → 443 [ACK] Seq=1048 Ack=3797 Win=131584 Len=0

Frame 26: 54 bytes on wire (432 bits), 54 bytes captured (432 bits) on interface \Device\NPF_{17019924-785A-4048-BC19-D72C2B93C6B0}, id 0
Ethernet II, Src: Microsof_17:9c:00 (bc:83:85:17:9c:00), Dst: Cisco_9f:fa:f9 (00:00:0c:9f:fa:f9)
Internet Protocol Version 4, Src: 10.248.150.150, Dst: 40.118.201.45
Transmission Control Protocol, Src Port: 59041, Dst Port: 443, Seq: 1048, Ack: 3797, Len: 0
    Source Port: 59041
    Destination Port: 443
    [Stream index: 1]
    [TCP Segment Len: 0]
    Sequence number: 1048    (relative sequence number)
    Sequence number (raw): 2253878478
    [Next sequence number: 1048    (relative sequence number)]
    Acknowledgment number: 3797    (relative ack number)
    Acknowledgment number (raw): 3228441395
    0101 .... = Header Length: 20 bytes (5)
    Flags: 0x010 (ACK)
    Window size value: 514
    [Calculated window size: 131584]
    [Window size scaling factor: 256]
    Checksum: 0x5b7c [unverified]
    [Checksum Status: Unverified]
    Urgent pointer: 0
    [SEQ/ACK analysis]
    [Timestamps]

No.     Time           Source                Destination           Protocol Length Info
     27 2.070735       10.248.150.150        216.58.196.130        TCP      55     58890 → 443 [ACK] Seq=1 Ack=1 Win=510 Len=1 [TCP segment of a reassembled PDU]

Frame 27: 55 bytes on wire (440 bits), 55 bytes captured (440 bits) on interface \Device\NPF_{17019924-785A-4048-BC19-D72C2B93C6B0}, id 0
Ethernet II, Src: Microsof_17:9c:00 (bc:83:85:17:9c:00), Dst: Cisco_9f:fa:f9 (00:00:0c:9f:fa:f9)
Internet Protocol Version 4, Src: 10.248.150.150, Dst: 216.58.196.130
Transmission Control Protocol, Src Port: 58890, Dst Port: 443, Seq: 1, Ack: 1, Len: 1
    Source Port: 58890
    Destination Port: 443
    [Stream index: 4]
    [TCP Segment Len: 1]
    Sequence number: 1    (relative sequence number)
    Sequence number (raw): 3951438699
    [Next sequence number: 2    (relative sequence number)]
    Acknowledgment number: 1    (relative ack number)
    Acknowledgment number (raw): 918551141
    0101 .... = Header Length: 20 bytes (5)
    Flags: 0x010 (ACK)
    Window size value: 510
    [Calculated window size: 510]
    [Window size scaling factor: -1 (unknown)]
    Checksum: 0x3fad [unverified]
    [Checksum Status: Unverified]
    Urgent pointer: 0
    [SEQ/ACK analysis]
    [Timestamps]
    TCP payload (1 byte)
    TCP segment data (1 byte)

No.     Time           Source                Destination           Protocol Length Info
     28 2.087193       216.58.196.130        10.248.150.150        TCP      66     443 → 58890 [ACK] Seq=1 Ack=2 Win=255 Len=0 SLE=1 SRE=2

Frame 28: 66 bytes on wire (528 bits), 66 bytes captured (528 bits) on interface \Device\NPF_{17019924-785A-4048-BC19-D72C2B93C6B0}, id 0
Ethernet II, Src: Cisco_53:71:40 (1c:e6:c7:53:71:40), Dst: Microsof_17:9c:00 (bc:83:85:17:9c:00)
Internet Protocol Version 4, Src: 216.58.196.130, Dst: 10.248.150.150
Transmission Control Protocol, Src Port: 443, Dst Port: 58890, Seq: 1, Ack: 2, Len: 0
    Source Port: 443
    Destination Port: 58890
    [Stream index: 4]
    [TCP Segment Len: 0]
    Sequence number: 1    (relative sequence number)
    Sequence number (raw): 918551141
    [Next sequence number: 1    (relative sequence number)]
    Acknowledgment number: 2    (relative ack number)
    Acknowledgment number (raw): 3951438700
    1000 .... = Header Length: 32 bytes (8)
    Flags: 0x010 (ACK)
    Window size value: 255
    [Calculated window size: 255]
    [Window size scaling factor: -1 (unknown)]
    Checksum: 0xdcaf [unverified]
    [Checksum Status: Unverified]
    Urgent pointer: 0
    Options: (12 bytes), No-Operation (NOP), No-Operation (NOP), SACK
    [SEQ/ACK analysis]
    [Timestamps]

No.     Time           Source                Destination           Protocol Length Info
     29 2.280761       10.248.150.150        216.58.196.130        TCP      55     58893 → 443 [ACK] Seq=1 Ack=1 Win=511 Len=1 [TCP segment of a reassembled PDU]

Frame 29: 55 bytes on wire (440 bits), 55 bytes captured (440 bits) on interface \Device\NPF_{17019924-785A-4048-BC19-D72C2B93C6B0}, id 0
Ethernet II, Src: Microsof_17:9c:00 (bc:83:85:17:9c:00), Dst: Cisco_9f:fa:f9 (00:00:0c:9f:fa:f9)
Internet Protocol Version 4, Src: 10.248.150.150, Dst: 216.58.196.130
Transmission Control Protocol, Src Port: 58893, Dst Port: 443, Seq: 1, Ack: 1, Len: 1
    Source Port: 58893
    Destination Port: 443
    [Stream index: 5]
    [TCP Segment Len: 1]
    Sequence number: 1    (relative sequence number)
    Sequence number (raw): 2717566529
    [Next sequence number: 2    (relative sequence number)]
    Acknowledgment number: 1    (relative ack number)
    Acknowledgment number (raw): 2988292544
    0101 .... = Header Length: 20 bytes (5)
    Flags: 0x010 (ACK)
    Window size value: 511
    [Calculated window size: 511]
    [Window size scaling factor: -1 (unknown)]
    Checksum: 0xb3a5 [unverified]
    [Checksum Status: Unverified]
    Urgent pointer: 0
    [SEQ/ACK analysis]
    [Timestamps]
    TCP payload (1 byte)
    TCP segment data (1 byte)

No.     Time           Source                Destination           Protocol Length Info
     30 2.297618       216.58.196.130        10.248.150.150        TCP      66     443 → 58893 [ACK] Seq=1 Ack=2 Win=264 Len=0 SLE=1 SRE=2

Frame 30: 66 bytes on wire (528 bits), 66 bytes captured (528 bits) on interface \Device\NPF_{17019924-785A-4048-BC19-D72C2B93C6B0}, id 0
Ethernet II, Src: Cisco_53:71:40 (1c:e6:c7:53:71:40), Dst: Microsof_17:9c:00 (bc:83:85:17:9c:00)
Internet Protocol Version 4, Src: 216.58.196.130, Dst: 10.248.150.150
Transmission Control Protocol, Src Port: 443, Dst Port: 58893, Seq: 1, Ack: 2, Len: 0
    Source Port: 443
    Destination Port: 58893
    [Stream index: 5]
    [TCP Segment Len: 0]
    Sequence number: 1    (relative sequence number)
    Sequence number (raw): 2988292544
    [Next sequence number: 1    (relative sequence number)]
    Acknowledgment number: 2    (relative ack number)
    Acknowledgment number (raw): 2717566530
    1000 .... = Header Length: 32 bytes (8)
    Flags: 0x010 (ACK)
    Window size value: 264
    [Calculated window size: 264]
    [Window size scaling factor: -1 (unknown)]
    Checksum: 0xae0b [unverified]
    [Checksum Status: Unverified]
    Urgent pointer: 0
    Options: (12 bytes), No-Operation (NOP), No-Operation (NOP), SACK
    [SEQ/ACK analysis]
    [Timestamps]

No.     Time           Source                Destination           Protocol Length Info
     32 3.011835       10.248.150.150        104.25.137.118        TCP      55     58886 → 443 [ACK] Seq=1 Ack=1 Win=509 Len=1 [TCP segment of a reassembled PDU]

Frame 32: 55 bytes on wire (440 bits), 55 bytes captured (440 bits) on interface \Device\NPF_{17019924-785A-4048-BC19-D72C2B93C6B0}, id 0
Ethernet II, Src: Microsof_17:9c:00 (bc:83:85:17:9c:00), Dst: Cisco_9f:fa:f9 (00:00:0c:9f:fa:f9)
Internet Protocol Version 4, Src: 10.248.150.150, Dst: 104.25.137.118
Transmission Control Protocol, Src Port: 58886, Dst Port: 443, Seq: 1, Ack: 1, Len: 1
    Source Port: 58886
    Destination Port: 443
    [Stream index: 6]
    [TCP Segment Len: 1]
    Sequence number: 1    (relative sequence number)
    Sequence number (raw): 1381219288
    [Next sequence number: 2    (relative sequence number)]
    Acknowledgment number: 1    (relative ack number)
    Acknowledgment number (raw): 1626524103
    0101 .... = Header Length: 20 bytes (5)
    Flags: 0x010 (ACK)
    Window size value: 509
    [Calculated window size: 509]
    [Window size scaling factor: -1 (unknown)]
    Checksum: 0xfa10 [unverified]
    [Checksum Status: Unverified]
    Urgent pointer: 0
    [SEQ/ACK analysis]
    [Timestamps]
    TCP payload (1 byte)
    TCP segment data (1 byte)

No.     Time           Source                Destination           Protocol Length Info
     33 3.234765       104.25.137.118        10.248.150.150        TCP      66     443 → 58886 [ACK] Seq=1 Ack=2 Win=67 Len=0 SLE=1 SRE=2

Frame 33: 66 bytes on wire (528 bits), 66 bytes captured (528 bits) on interface \Device\NPF_{17019924-785A-4048-BC19-D72C2B93C6B0}, id 0
Ethernet II, Src: Cisco_53:71:40 (1c:e6:c7:53:71:40), Dst: Microsof_17:9c:00 (bc:83:85:17:9c:00)
Internet Protocol Version 4, Src: 104.25.137.118, Dst: 10.248.150.150
Transmission Control Protocol, Src Port: 443, Dst Port: 58886, Seq: 1, Ack: 2, Len: 0
    Source Port: 443
    Destination Port: 58886
    [Stream index: 6]
    [TCP Segment Len: 0]
    Sequence number: 1    (relative sequence number)
    Sequence number (raw): 1626524103
    [Next sequence number: 1    (relative sequence number)]
    Acknowledgment number: 2    (relative ack number)
    Acknowledgment number (raw): 1381219289
    1000 .... = Header Length: 32 bytes (8)
    Flags: 0x010 (ACK)
    Window size value: 67
    [Calculated window size: 67]
    [Window size scaling factor: -1 (unknown)]
    Checksum: 0xa95a [unverified]
    [Checksum Status: Unverified]
    Urgent pointer: 0
    Options: (12 bytes), No-Operation (NOP), No-Operation (NOP), SACK
    [SEQ/ACK analysis]
    [Timestamps]

No.     Time           Source                Destination           Protocol Length Info
     37 4.294478       10.248.150.150        40.90.10.136          TCP      66     59042 → 443 [SYN] Seq=0 Win=64240 Len=0 MSS=1460 WS=256 SACK_PERM=1

Frame 37: 66 bytes on wire (528 bits), 66 bytes captured (528 bits) on interface \Device\NPF_{17019924-785A-4048-BC19-D72C2B93C6B0}, id 0
Ethernet II, Src: Microsof_17:9c:00 (bc:83:85:17:9c:00), Dst: Cisco_9f:fa:f9 (00:00:0c:9f:fa:f9)
Internet Protocol Version 4, Src: 10.248.150.150, Dst: 40.90.10.136
Transmission Control Protocol, Src Port: 59042, Dst Port: 443, Seq: 0, Len: 0
    Source Port: 59042
    Destination Port: 443
    [Stream index: 7]
    [TCP Segment Len: 0]
    Sequence number: 0    (relative sequence number)
    Sequence number (raw): 323489421
    [Next sequence number: 1    (relative sequence number)]
    Acknowledgment number: 0
    Acknowledgment number (raw): 0
    1000 .... = Header Length: 32 bytes (8)
    Flags: 0x002 (SYN)
    Window size value: 64240
    [Calculated window size: 64240]
    Checksum: 0x957c [unverified]
    [Checksum Status: Unverified]
    Urgent pointer: 0
    Options: (12 bytes), Maximum segment size, No-Operation (NOP), Window scale, No-Operation (NOP), No-Operation (NOP), SACK permitted
    [Timestamps]

No.     Time           Source                Destination           Protocol Length Info
     38 4.368033       10.248.150.150        162.247.242.20        TCP      55     58894 → 443 [ACK] Seq=1 Ack=1 Win=63175 Len=1 [TCP segment of a reassembled PDU]

Frame 38: 55 bytes on wire (440 bits), 55 bytes captured (440 bits) on interface \Device\NPF_{17019924-785A-4048-BC19-D72C2B93C6B0}, id 0
Ethernet II, Src: Microsof_17:9c:00 (bc:83:85:17:9c:00), Dst: Cisco_9f:fa:f9 (00:00:0c:9f:fa:f9)
Internet Protocol Version 4, Src: 10.248.150.150, Dst: 162.247.242.20
Transmission Control Protocol, Src Port: 58894, Dst Port: 443, Seq: 1, Ack: 1, Len: 1
    Source Port: 58894
    Destination Port: 443
    [Stream index: 8]
    [TCP Segment Len: 1]
    Sequence number: 1    (relative sequence number)
    Sequence number (raw): 1412621239
    [Next sequence number: 2    (relative sequence number)]
    Acknowledgment number: 1    (relative ack number)
    Acknowledgment number (raw): 3812664841
    0101 .... = Header Length: 20 bytes (5)
    Flags: 0x010 (ACK)
    Window size value: 63175
    [Calculated window size: 63175]
    [Window size scaling factor: -1 (unknown)]
    Checksum: 0xd972 [unverified]
    [Checksum Status: Unverified]
    Urgent pointer: 0
    [SEQ/ACK analysis]
    [Timestamps]
    TCP payload (1 byte)
    TCP segment data (1 byte)

No.     Time           Source                Destination           Protocol Length Info
     39 4.488014       40.90.10.136          10.248.150.150        TCP      66     443 → 59042 [SYN, ACK] Seq=0 Ack=1 Win=64240 Len=0 MSS=1452 WS=1 SACK_PERM=1

Frame 39: 66 bytes on wire (528 bits), 66 bytes captured (528 bits) on interface \Device\NPF_{17019924-785A-4048-BC19-D72C2B93C6B0}, id 0
Ethernet II, Src: Cisco_53:71:40 (1c:e6:c7:53:71:40), Dst: Microsof_17:9c:00 (bc:83:85:17:9c:00)
Internet Protocol Version 4, Src: 40.90.10.136, Dst: 10.248.150.150
Transmission Control Protocol, Src Port: 443, Dst Port: 59042, Seq: 0, Ack: 1, Len: 0
    Source Port: 443
    Destination Port: 59042
    [Stream index: 7]
    [TCP Segment Len: 0]
    Sequence number: 0    (relative sequence number)
    Sequence number (raw): 3168673142
    [Next sequence number: 1    (relative sequence number)]
    Acknowledgment number: 1    (relative ack number)
    Acknowledgment number (raw): 323489422
    1000 .... = Header Length: 32 bytes (8)
    Flags: 0x012 (SYN, ACK)
    Window size value: 64240
    [Calculated window size: 64240]
    Checksum: 0xbb26 [unverified]
    [Checksum Status: Unverified]
    Urgent pointer: 0
    Options: (12 bytes), Maximum segment size, No-Operation (NOP), Window scale, No-Operation (NOP), No-Operation (NOP), SACK permitted
    [SEQ/ACK analysis]
    [Timestamps]

No.     Time           Source                Destination           Protocol Length Info
     40 4.488293       10.248.150.150        40.90.10.136          TCP      54     59042 → 443 [ACK] Seq=1 Ack=1 Win=132096 Len=0

Frame 40: 54 bytes on wire (432 bits), 54 bytes captured (432 bits) on interface \Device\NPF_{17019924-785A-4048-BC19-D72C2B93C6B0}, id 0
